ngrams,state,Notes
,", Nebraska",University of Nebraska - Lincoln Extension publications -- Note added 11/20/13 19:14
national guard,", Idaho",Idaho Army National Guard -- Note added 1/23/14 14:03
lottery,", Idaho",Idaho Lottery -- Note added 6/12/13 14:09
,", Idaho",IDeal - Idaho College Savings Program -- Note added 7/8/13 19:00
services,", Indiana","Benefits Portal, http://www.in.gov/fssa/ Indiana Family and Social Services Administration -- Note added 11/20/13 19:35"
"office,state",", Illinois",Office of the Illinois State Treasurer -- Note added 7/2/14 18:37
lottery,", Illinois",Illinois Lottery -- Note added 6/12/13 14:09
"travel tourism,travel tourism site,travel,tourism,tourism site,site",", New York",Travel and Tourism Site for New York -- Note added 6/6/13 19:12
"health,carolina,north",", North Carolina","Inclusive Health, North Carolina Health Insurance Risk Pool, Inc. -- Note added 11/20/13 19:54"
"public,state",", Washington",Innovate Washington is hereby created as a state agency exercising public and essential governmental functions. Innovate Washington is created as the successor to the Washington technology center and the Spokane intercollegiate research and technology institute (SIRTI). See http://apps.leg.wa.gov/RCW/default.aspx?cite=43.333&full=true  -- Note added 7/23/14 14:21
"economic development authority,public,authority,economic development,site",", Guam",Guam Economic Development Authority (GEDA) web site. GEDA is an autonomous agency of the Government of Guam and a Guam public corporation. -- Note added 6/7/13 17:59
board,", Montana",Montana Board of Investments -- Note added 11/21/13 14:44
"economic development authority,economic development,authority",", Iowa",Iowa Economic Development Authority -- Note added 11/21/13 15:05
,", Iowa, Oklahoma","Iowa Tribe of Oklahoma, Perkins, OK -- Note added 11/21/13 15:11"
national guard,", Iowa",Iowa National Guard -- Note added 1/23/14 14:03
state,", Iowa",Iowa State Fair -- Note added 6/12/13 18:48
"public health,public,north,health,carolina,division public health,division",", North Carolina","The North Carolina Division of Public Health, Injury and Violence Prevention Branch, Youth Suicide Prevention Program works in collaboration with The North Carolina Youth Suicide Prevention Task Force to address youth suicide prevention in North Carolina. -- Note added 11/21/13 20:33"
site,,new jersey history site -- Note added 9/16/15 14:49
"north,state,authority,carolina,division",", North Carolina",Julian F. Keith Alcohol and Drug Abuse Treatment Center. JFK ADATC operates under the authority of the State of North Carolina through the Division of State Operated Healthcare Facilities -- Note added 9/22/15 17:00
department,,Jobs4Jersey. NJ Department of Labor and Workforce Development. -- Note added 6/6/13 18:08
,", Guam","Unified Courts of Guam, Guam Judiciary - www.justice.gov.gu -- Note added 6/7/13 17:57"
"services,commission",,"Justice Administration Commission - The Justice Administrative Commission (JAC), created in 1965, provides administrative services on behalf of 49 judicial related entities. -- Note added 6/23/15 19:03"
,", Kentucky",Kentucky Academic Advising Association -- Note added 1/3/14 13:19
,", Kansas",Kansas Highway Patrol -- Note added 7/9/14 4:30
,,kentucky center -- Note added 8/27/15 16:36
national guard,", Kentucky",Kentucky National Guard -- Note added 1/23/14 14:03
,, kentucky housing corp -- Note added 8/27/15 16:37
state,", Kentucky",Kentucky State Police -- Note added 6/12/13 18:09
"travel tourism,travel tourism site,travel,tourism,tourism site,site",", Kentucky",Travel and Tourism Site for Kentucky -- Note added 6/6/13 19:38
authority,", Kentucky",Kentucky Higher Education Assistance Authority -- Note added 7/26/13 17:48
,,Ky legislature -- Note added 8/27/15 16:39
"board,state board,state",", Kansas",Kansas State Board of Healing Arts -- Note added 7/9/14 4:38
"board,state board,state",", Kansas",Kansas State Board of Nursing -- Note added 7/9/14 4:39
,", Kansas",Kansas Judicial Branch -- Note added 7/9/14 4:40
department,", Kansas",Kansas Department of Transportation -- Note added 3/20/14 15:35
,", Kansas",Kansas Historical Society -- Note added 7/9/14 4:41
state,", Kansas",Kansas State Legislature -- Note added 7/9/14 4:42
lottery,", Kansas",Kansas Lottery -- Note added 6/12/13 14:09
department,", Kansas",Kansas Department of Revenue -- Note added 7/9/14 4:44
"office,state",", Kansas","Office of the Secretary of State, State of Kansas -- Note added 7/23/14 15:51"
department,", Kentucky",Kentucky Department of Agriculture -- Note added 7/5/13 17:39
,,ky convention center  -- Note added 8/27/15 16:39
board,", Kentucky",Kentucky Education Professional Standards Board -- Note added 7/5/13 17:38
,,KY expo center -- Note added 8/27/15 16:41
lottery,", Kentucky",Kentucky Lottery -- Note added 6/12/13 14:10
,,KY Treasury -- Note added 8/27/15 16:42
"board,board examiners",,LA Board of Examiners of Nursing Facility Administrators -- Note added 9/22/15 20:03
board,", Louisiana",Louisiana Board of Massage Therapy -- Note added 11/12/15 17:36
board,", Louisiana",Louisiana Board of Pharmacy -- Note added 8/24/15 14:41
"board,state board,state",", Louisiana",Louisiana State Board of Social Work Examiners -- Note added 8/24/15 14:41
"board,state board,state",", Louisiana", Louisiana State Board of Chiropractic Examiners -- Note added 8/24/15 14:42
services,", Louisiana",The Council of Information Services Directors for Louisiana -- Note added 8/24/15 14:43
"board,board examiners",", Louisiana",Louisiana Board of Examiners of Certified Shorthand Reporters -- Note added 9/23/15 12:16
,", Louisiana",Louisiana Developmental Disabilities Council -- Note added 9/23/15 13:30
"department,commission",", Louisiana","Louisiana Egg Commission, Louisiana Department of Agriculture & Forestry  -- Note added 9/23/15 14:53"
board,", Louisiana",Louisiana Auctioneers Licensing Board -- Note added 9/23/15 16:37
board,", Louisiana",Louisiana Professional Engineering and Land Surveying Board -- Note added 8/24/15 14:46
board,", Louisiana",Louisiana Physical Therapy Board -- Note added 8/24/15 14:46
,", Louisiana",Louisiana Supreme Court -- Note added 9/23/15 16:38
"board,state board,state",", Louisiana",Louisiana State Board of Architectural Examiners -- Note added 1/14/14 14:13
commission,", Louisiana",Louisiana Workforce Commission (LAWorks) -- Note added 9/23/15 16:41
"board,board examiners",", Louisiana",Louisiana Board of Examiners in Dietetics and Nutrition  -- Note added 8/24/15 14:48
board,", Louisiana",Louisiana board of speech language pathology -- Note added 8/24/15 14:51
,", Virgin Islands",Legislature of the Virgin Islands -- Note added 8/18/14 14:07
,", Kansas",League of Kansas Municipalities -- Note added 7/9/14 4:50
"carolina department,carolina,department",", South Carolina","South Carolina Department of Labor, Licensing and Regulation -- Note added 1/17/14 15:50"
,", Minnesota","League of Minnesota Cities Per the 'About the League' section of their website, LMC is 'a membership organization dedicated to promoting excellence in local government.'  -- Note added 4/26/15 4:37"
,", Puerto Rico",LoterÃ­a ElectrÃ³nica de Puerto Rico -- Note added 6/12/13 14:11
authority,", Louisiana",Louisiana Community Development Authority -- Note added 9/23/15 12:18
lottery,", Louisiana",Louisiana Lottery Corporation -- Note added 6/12/13 14:13
"board,state",", Louisiana","Louisiana Seafood Board. In 1984, the State of Louisiana created the Louisiana Seafood Promotion & Marketing Board. For more information see https://www.legis.la.gov/legis/BoardMembers.aspx?boardId=355. -- Note added 11/12/15 15:08"
commission,", Louisiana",Louisiana Tax Free Shopping Commission -- Note added 9/23/15 16:44
"travel tourism,travel tourism site,travel,tourism,tourism site,site",", Louisiana",Travel and Tourism Site for Louisiana -- Note added 6/6/13 19:40
"board,board examiners",,Licensed Professional Counselors Board of Examiners -- Note added 8/24/15 14:53
,", Louisiana",Police Jury Association of Louisiana -- Note added 7/23/13 19:36
"board,board examiners",,LLPVRC Board of Examiners -- Note added 8/24/15 14:54
"board examiners,state,state board examiners,board,state board",", Louisiana",Louisiana State Board of Examiners of Psychologists   -- Note added 8/24/15 14:55
"board examiners,state,state board examiners,board,state board",", Louisiana",Louisiana State Board of Examiners for Sanitarians -- Note added 9/23/15 16:47
"board examiners,state,state board examiners,board,state board",", Louisiana",Louisiana State Board of Examiners of Interior Designers -- Note added 9/23/15 16:48
board,", Louisiana",Louisiana Board of Massage Therapy -- Note added 11/12/15 17:34
"board,state board,state",", Louisiana",Louisiana State Board of Private Investigator Examiners -- Note added 8/24/15 14:55
"board,state board,state",,LOUISIANA STATE BOARD OF PRACTICAL NURSE EXAMINERS -- Note added 8/24/15 14:56
board,", Louisiana",Louisiana Board of Veterinary Medicine -- Note added 8/24/15 14:56
board,", Louisiana",Louisiana Board of Drug and Device Distributors -- Note added 8/24/15 14:57
,,LSU Ag Center -- Note added 8/24/15 14:57
,", Wisconsin",League of Wisconsin Municipalities -- Note added 8/5/14 6:00
,,maine history -- Note added 8/27/15 18:29
"authority,state",,maine state housing authority -- Note added 8/27/15 18:30
"lottery,state",", Maine",Maine State Lottery - www.mainelottery.com -- Note added 6/12/13 14:14
authority,,maine turnpike authority -- Note added 8/27/15 18:30
,", Maryland",Comptroller of Maryland -- Note added 5/27/14 3:01
,,Mass budget & policy Center -- Note added 8/26/15 16:11
,,Ma cultural Council -- Note added 8/26/15 16:11
,,Mass historical society -- Note added 8/26/15 16:12
"lottery,state",,Massachuetts State Lottery -- Note added 6/12/13 14:14
"travel tourism,travel tourism site,travel,tourism,tourism site,site",", Massachusetts",Travel and Tourism Site for Massachusetts -- Note added 6/6/13 19:40
state,", Montana","Montana Bureau of Mines and Geology, a nonregulatory state agency -- Note added 11/22/13 13:34"
department,", Maryland","Maryland 511 Traveller Information, Maryland Department of Transportation -- Note added 1/26/15 12:49"
,,maine development foundation -- Note added 8/27/15 18:31
department,", Maryland",Maryland Department of Housing and Community Development -- Note added 6/6/13 18:08
"office,state",", Maryland","Maryland Kids Page, Office of the Secretary of State -- Note added 6/6/13 18:08"
lottery,", Maryland",Maryland Lottery -- Note added 6/12/13 14:14
authority,", Maryland",Maryland Stadium Authority -- Note added 5/27/14 3:08
department,", Mississippi","Mississippi Department of Wildlife, Fisheries, and Parks -- Note added 7/25/14 12:41"
,,Municipal Employees' Retirement System -- Note added 9/3/15 15:37
office,", Montana","Montana Guaranteed Student Loan Program (MGSLP), a program within the Office of the Commissioner of Higher Education -- Note added 11/22/13 13:35"
"health,authority",", Alaska",Alaska Mental Health Trust Authority -- Note added 6/6/13 18:08
"health,office",", Alaska",Alaska Mental Health Trust Land Office -- Note added 6/6/13 18:08
"travel tourism,travel tourism site,travel,tourism,tourism site,site",", Michigan",Travel and Tourism Site for Michigan -- Note added 6/6/13 19:41
,,michigan humanities council -- Note added 9/3/15 15:38
lottery,", Michigan",Michigan Lottery -- Note added 12/17/14 12:25
state,", Michigan",Michigan State Park and Harbor Reservations  -- Note added 9/3/15 15:41
lottery,", Michigan",Michigan Lottery Connect (Blog) -- Note added 12/17/14 12:29
national guard,", Michigan",Michigan National Guard -- Note added 1/23/14 14:03
national guard,", Minnesota",Minnesota National Guard URL must have 'www' to resolve  -- Note added 4/26/15 5:37
authority,", Mississippi",Mississippi Development Authority -- Note added 7/25/14 12:42
state,", Mississippi",Campgrounds and Camping at Mississippi State Parks -- Note added 3/20/14 16:45
,", Missouri","Missouri Center for the Books, an affiliate of the national Center for the Book in the Library of Congress, which was established by law in 1977 to strengthen and celebrate the vital role of books, reading, and libraries in the cultural life of the nation. -- Note added 1/13/14 19:38"
division,", Missouri","MissouriFamilies is produced by the College of Human Environmental Sciences, Extension Division, University of Missouri -- Note added 1/10/14 19:17"
,", Minnesota","Minnesota Association of Watershed Districts, Inc. Per the 'What is MAWD?' section of their website, 'the Minnesota Association of Watershed Districts provides educational opportunities, information and training for watershed district managers and staff through yearly tours, meetings and quarterly newsletters.' -- Note added 4/26/15 5:42"
national guard,", Missouri",Missouri National Guard -- Note added 1/23/14 14:03
lottery,", Missouri",Missouri Lottery -- Note added 6/12/13 14:15
state,", Alabama",The Alabama State Treasury's official website for unclaimed property searches -- Note added 6/6/13 18:08
"tourism,office,site,state",", Montana","Montana Kids, an official state site of the http://visitmt.com/ Montana Office of Tourism. -- Note added 11/22/13 13:38"
lottery,", Montana",Montana Lottery -- Note added 6/12/13 14:15
state,", Montana","Montana State Fund, created by the state legislature in 1990 to create a fair and equitable system of workers' compensation insurance. -- Note added 11/18/13 16:26"
state,,Mountain State Combined Federal Campaign -- Note added 7/24/14 5:41
state,", Mississippi","Mississippi Industries for the Blind, a state agency of Mississippi -- Note added 7/25/14 12:47"
"board,state board,state",", Mississippi",Mississippi State Board of Contractors -- Note added 7/25/14 12:48
commission,", Mississippi",Mississippi Athletic Commission -- Note added 7/25/14 12:49
"commission,state",", Maryland",Maryland State Commission on Criminal Sentencing Policy -- Note added 5/27/14 3:25
,", Mississippi",Mississippi Emergency Management Agency -- Note added 7/25/14 12:51
,", Mississippi",Mississippi Home Corporation -- Note added 7/25/14 12:52
"state university extension,state",", Mississippi",Mississippi State University Extension -- Note added 7/25/14 12:52
"state university extension,state",", Michigan",Michigan State University Extension -- Note added 11/19/13 13:43
"state university extension,state",", Montana",Montana State University Extension -- Note added 11/22/13 13:44
"department,authority",", Montana","Montana Facility Finance Authority, MT Department of Commerce -- Note added 11/22/13 13:46"
department,", Montana","Montana Finance Information Center, MT Department of Commerce -- Note added 11/22/13 13:55"
lottery,", Arkansas",Arkansas Scholarship Lottery -- Note added 6/12/13 14:17
state,", Florida",The official state portal of the State of Florida -- Note added 6/6/13 18:08
"department,services",", Florida",Florida Department of Financial Services -- Note added 7/31/13 17:13
office,", Florida",Florida Office of the Attorney General -- Note added 1/10/14 19:17
health,", Florida",Developed by the Florida Attorney General and the Agency for Health Care Administration (AHCA) to help consumers shop for the lowest price in their area for their prescription drugs. -- Note added 1/10/14 19:17
commission,", Florida",Florida Fish and Wildlife Conservation Commission -- Note added 7/7/14 12:02
"travel tourism,travel tourism site,travel,tourism,tourism site,site",", Northern Mariana Islands",Travel and Tourism Site for the Northern Mariana Islands -- Note added 6/6/13 19:42
,", Virgin Islands","National Archives and Records Management Unit, Government of the Virgin Islands -- Note added 8/18/14 14:03"
nc,,NC Museum of Natural Sciences -- Note added 11/12/15 15:15
nc,,NC Council on Developmental Disabilities -- Note added 1/14/14 14:15
"lottery,carolina,north",", North Carolina",North Carolina Education Lottery -- Note added 6/12/13 14:18
"office,nc,state",,NC State Construction Office -- Note added 9/16/15 13:21
"carolina,north,commission",", North Carolina",North Carolina Alcoholic Beverage Control Commission -- Note added 9/11/15 20:30
nc,,NC Agriculture Development & Farmland Preservation Trust Fund -- Note added 11/12/15 15:13
"department,north,carolina department,department agriculture consumer,services,carolina,division",", North Carolina","Multi-Hazard Threat Database, Emergency Programs Division, North Carolina Department of Agriculture and Consumer Services -- Note added 7/26/13 15:42"
"carolina,division,north",", North Carolina",North Carolina Division of Air Quality -- Note added 3/20/14 15:16
"board,carolina,north",", North Carolina",The North Carolina Auctioneers board -- Note added 9/11/15 20:32
nc,,NC Court System  -- Note added 9/11/15 20:32
"board,nc",,NC appraisal board -- Note added 9/11/15 20:33
"nc,public",,NC Triangle Public Access TV n  n  -- Note added 9/11/15 20:35
nc,,NC Aquariums -- Note added 9/11/15 20:35
nc,,NC Museum of Art -- Note added 9/11/15 20:36
"carolina,north",", North Carolina",North Carolina Arts Council -- Note added 11/20/13 12:24
"department,public,health,department education,nc department,nc,department health human,services,division,health human services",,"NC Assistive technology Program - Receives grant funding under Public Law 108-364  through the Rehabilitation Services Administration, U.S. Department of Education, and is administered by the N.C. Department of Health and Human Services, Division of Vocational Rehabilitation Services -- Note added 11/12/15 15:02"
"office,nc,state",,NC Office of the State Auditor -- Note added 1/14/14 13:12
"board,carolina,north",", North Carolina",North Carolina Board of Architecture -- Note added 9/11/15 20:37
"board,nc",,NC Board of Athletic Trainers Examiners -- Note added 9/11/15 20:38
"board,carolina,north",", North Carolina",North Carolina Board of Dietetics/Nutrition   -- Note added 9/11/15 20:38
"board,board examiners,nc",,NC Board of Examiners of electrical contractors -- Note added 9/11/15 20:39
"board,board examiners,nc",,NC Board of Examiners for engineers and surveyors -- Note added 9/11/15 20:40
"board,nc",,NC Board of Nursing Homes Administrators -- Note added 9/11/15 20:41
"board,nc,services",,NC Board of Funeral Services -- Note added 9/11/15 20:41
"board,nc",,NC Board of Law Examiners -- Note added 9/14/15 20:44
"board,carolina,north",", North Carolina",The North Carolina Board for the Licensing of Geologists  -- Note added 9/14/15 20:27
"board,carolina,north",", North Carolina",The North Carolina Board of Licensed Professional Counselors -- Note added 9/14/15 20:28
"carolina,north",", North Carolina",The North Carolina Soil Scientist Licensing Program -- Note added 9/14/15 20:28
"board,board examiners,nc",,NC Board of Examiners for Speech Language and Pathologist & Audiologist n  -- Note added 9/14/15 20:30
"board,nc",,Welcome to the NC Board of Landscape Architects -- Note added 9/14/15 20:31
"board,nc",,NC Board of Nursing -- Note added 9/14/15 20:31
"board,nc",,NC Board of Pharmacy -- Note added 9/14/15 20:32
"board,carolina,north",", North Carolina",The North Carolina Board of Occupational Therapy -- Note added 9/14/15 20:32
"board,carolina,north,state",", North Carolina",The Board of Podiatry Examiners for the State of North Carolina  -- Note added 9/14/15 20:32
nc,,NC Waste Management -- Note added 9/14/15 20:33
nc,,nc business court -- Note added 9/14/15 20:33
nc,,NC School bus Safety -- Note added 9/14/15 20:34
"department,north,carolina department,carolina,division",", North Carolina","Rail Division, North Carolina Department of Transportation -- Note added 7/24/13 16:07"
"board,carolina,north",", North Carolina",North Carolina Social Work Certification and Licensure Board -- Note added 9/22/15 14:10
"carolina,north",", North Carolina","The North Carolina Center for Global Logistics is a collaborative effort between community colleges, universities, and industry partners focused on developing a highly trained workforce for the logistics and supply chain industry. -- Note added 9/14/15 20:47"
nc,,NC Child Support Enforcement -- Note added 9/14/15 20:36
"board,carolina,north",", North Carolina",North Carolina Board of Chiropractic Examiners -- Note added 9/14/15 20:37
"department,north,carolina department,department cultural resources,carolina",", North Carolina","North Carolina Civil War Sesquicentennial, North Carolina Department of Cultural Resources -- Note added 11/12/15 14:54"
"division,nc",,NC Division of Coastal Management -- Note added 1/14/14 14:16
nc,,"NC Coastal Reserve and National Estuarine Research Reserve, NC DEQ -- Note added 11/12/15 14:51"
"carolina,office,north",", North Carolina",North Carolina Office of the Commissioner of Banks (NCCOB) -- Note added 11/19/13 18:51
"department,carolina department,carolina,north",", North Carolina",North Carolina Department of Commerce -- Note added 7/24/13 16:42
nc,,nc court system -- Note added 9/14/15 20:38
"nc,public",,NC Dept of Public Safety -- Note added 9/14/15 20:39
"nc,department,nc department",,N.C. Department of Environment and Natural Resources -- Note added 7/24/13 16:27
"north,state,board,state board,carolina",", North Carolina",North Carolina State Board of Dental Examiners -- Note added 9/14/15 20:40
"carolina,site,north",", North Carolina","This site is a tool for North Carolina citizens and providers to reduce the impact of diabetes through leadership, education, communication and community involvement. -- Note added 9/14/15 20:41"
"carolina,office,nc,north",", North Carolina","The NC Helping Neighbors Fund is managed by the Governor's Office, in partnership with United Way of North Carolina. Donations are tax deductible; 100% of donated funds will go to the states impacted by Hurricane Sandy. -- Note added 9/14/15 20:48"
"public,department,nc department,nc,nc department public,division",," Juvenile Justice section of the N.C. Department of Public Safety, Division of Adult Correction and Juvenile Justice.  -- Note added 9/15/15 16:00"
"nc,division",,"Division of Marine Fisheries, NC DENR -- Note added 11/12/15 14:07"
"nc,commission",,NC Marine Fisheries Commission Store -- Note added 11/12/15 14:39
"division,nc,public",,NC Division of Non Public Education -- Note added 9/15/15 16:01
"department,carolina department,carolina,north",", North Carolina",North Carolina Department of Insurance -- Note added 11/19/13 20:06
,,Dept of Justice -- Note added 9/15/15 16:04
"carolina,north",", North Carolina",North Carolina Drought Management Advisory Council -- Note added 11/12/15 14:05
"division,nc",,NC DENR's Division of Waste Management -- Note added 11/12/15 13:55
"carolina,office,north",", North Carolina",The North Carolina Office of EMS -- Note added 9/15/15 16:07
"carolina,public,north,state",", North Carolina",The North Carolina Forest Service operates a system of six Educational State Forests (ESFs) designed to teach the public - especially school children - about the forest environment. -- Note added 9/15/15 16:34
"nc,division",,"Facility Management Division, NC DOA -- Note added 11/12/15 13:45"
"carolina,north",", North Carolina","North Carolina Farm Fresh is a directory of pick-your-own farms, roadside farm markets, and farmers markets throughout North Carolina. It is designed to help the consumer, find the freshest locally grown fruits, vegetables, christmas trees, ornamental plants, flowers, and herbs. -- Note added 9/15/15 16:34"
"department,north,carolina department,nc,department agriculture consumer,services,carolina",", North Carolina","NC Farm to School program, North Carolina Department of Agriculture and Consumer Services -- Note added 6/12/13 18:34"
"health,carolina,office,north",", North Carolina","North Carolina Farmworker Health Program (NCFHP), a statewide Migrant Health Voucher Program within the Office of Rural Health -- Note added 11/12/15 13:44"
"office,nc",,NC Film Office -- Note added 9/15/15 16:35
"carolina,north",", North Carolina","Firewise North Carolina, North Carolina Forest Service -- Note added 6/12/13 18:15"
division,,Division of Marine Fisheries  -- Note added 9/15/15 16:36
nc,,NC flood risk information system -- Note added 9/15/15 16:37
nc,,NC Foreclosure Prevention Fund -- Note added 11/12/15 13:43
"carolina,north",", North Carolina","North Carolina Forest Action Plan, North Carolina Forest Service -- Note added 11/12/15 13:40"
"carolina,north",", North Carolina",North Carolina Forest Action Plan See historical snapshot at: http://web.archive.org/web/20140517174935/http://ncforestassessment.com/  -- Note added 11/12/15 13:39
"site,nc",,NC Fresh Produce Information site -- Note added 9/15/15 16:37
"carolina,north,state",", North Carolina",State of North Carolina -- Note added 1/14/14 13:05
"department,public,north,nc department,nc,nc department public,carolina",", North Carolina","Governor's School of North Carolina, NC Department of Public Instruction -- Note added 6/12/13 18:35"
"carolina,north",", North Carolina",The North Carolina Global TransPark -- Note added 9/15/15 16:39
nc,,NC hearing Aid Dealers -- Note added 9/15/15 16:39
"health human services,health,nc,services",,NC Health & Human Services -- Note added 9/15/15 16:39
nc,,NC Healthy School Website -- Note added 9/15/15 16:41
nc,,NC Housing Finance Agency  -- Note added 9/15/15 16:42
"board,carolina,north",", North Carolina",North Carolina Home Inspetor Licensure Board -- Note added 11/20/13 12:38
nc,,NC Historic Sites -- Note added 9/15/15 16:42
"office,services",,Office of Indigent Defense Services  -- Note added 9/15/15 16:43
