ngrams,state,Notes
nc,,NC International House -- Note added 9/15/15 16:44
nc,,NC Institute of Medecine -- Note added 9/15/15 16:45
"board,carolina,north",", North Carolina",The North Carolina Interpreters & Transliterators Licensing Board -- Note added 9/15/15 16:45
"carolina,state,north,services",", North Carolina",NCknows is a service that allows North Carolina residents to get help from librarians and use their library resources remotely through a computer. NCknows is a pilot project supported by a grant under the Federally-funded Library Services and Technology Act (LSTA). The project is administered by the State Library of North Carolina in Raleigh with help from a committee of librarians and directors from North Carolina's libraries. -- Note added 11/12/15 13:22
nc,,NC Dept of Labor -- Note added 9/15/15 16:45
nc,,NC Generla Assembly  -- Note added 9/15/15 16:46
"board examiners,north,state,state board examiners,board,state board,carolina",", North Carolina","North Carolina State Board of Examiners of Plumbing, Heating and Fire Sprinkler Contractors -- Note added 9/15/15 16:46"
"nc,state",,NC Lifetime Income - Members of the Teachers' and State Employees' Retirement System (TSERS) and Local Governmental Employees' Retirement System (LGERS) will have a one-time opportunity to transfer all or part of their NC 401(k) and/or NC Deferred Compensation (457) funds to the Retirement System in order to receive lifetime income at or after retirement. -- Note added 11/12/15 13:21
"nc,public",,NC Public Library -- Note added 9/15/15 16:47
"carolina,north",", North Carolina",North Carolina League of Municipalities -- Note added 6/6/13 18:08
"board,carolina,north",", North Carolina",the board of Marriage and family therapy of North Carolina -- Note added 9/15/15 16:48
"board,carolina,north",", North Carolina",The North Carolina Locksmith Licensing Board -- Note added 9/15/15 16:48
"north,state,office,services,carolina",", North Carolina",State of North Carolina Office of Information Technology Services -- Note added 9/15/15 16:49
"carolina,north",", North Carolina",North Carolina Maritime Museum System -- Note added 8/2/13 15:50
"department,north,nc department,nc,department cultural resources,carolina",", North Carolina","North Carolina Highway Historical Marker Program, NC Department of Cultural Resources -- Note added 11/12/15 13:19"
"board,nc",,NC Medical Board -- Note added 9/15/15 16:53
"division,nc",,NC Division of Medical Assistance -- Note added 9/15/15 16:54
"health,office,nc",,N.C. Office of Minority Health and Health Disparities -- Note added 9/15/15 16:55
nc,,NC Motor fleet management -- Note added 9/15/15 16:55
"health,nc",,The N.C. Health Care Personnel Registry Section   -- Note added 9/15/15 16:56
nc,,Early Hearing Detection and Intervention Program (NC DHHS &gt; DPH &gt; WCH Section &gt; Children and Youth Branch) -- Note added 11/12/15 13:18
"carolina,north",", North Carolina",The North Carolina Natural Heritage Program -- Note added 9/15/15 16:56
"state agencies,carolina,north,state",", North Carolina","Established in 1987, the North Carolina Natural Heritage Trust Fund provided supplemental funding to select state agencies for the acquisition and protection of important natural areas, to preserve the state's ecological diversity and cultural heritage, and to inventory the natural heritage resources of the state. In July 2013, these key purposes were incorporated in the Clean Water Management Trust Fund enabling legislation and the NHTF statute was repealed. See historical snapshot at:  http://web.archive.org/web/20150129185256/http://www.ncnhtf.org/pages/aboutnhtf.htm  -- Note added 11/12/15 13:15"
"carolina,office,north",", North Carolina",North Carolina Office of Administrative Hearings -- Note added 9/15/15 16:57
nc,,Welcome to the Grand Chapter of NC Order of the Eastern Star -- Note added 9/15/15 16:57
"north,nc,public",", North Carolina",NC OneMap is a public service providing comprehensive discovery and access to North Carolina's geospatial data resources. -- Note added 9/15/15 16:58
"north,nc,public",", North Carolina","NC OneMap, a public service providing comprehensive discovery and access to North Carolina's geospatial data resources. -- Note added 11/12/15 13:13"
"board examiners,north,state,state board examiners,board,state board,carolina",", North Carolina",he North Carolina State Board of Examiners in Optometry -- Note added 9/15/15 16:58
"public,department,health,nc department,nc,nc department public,public health",,"NC Physical Activity and Nutrition Branch (NC PAN), NC Department of Public Health See historical snapshot at: http://web.archive.org/web/20130128034822/http://www.ncpanbranch.com/  -- Note added 11/12/15 13:12"
nc,,NC ports  -- Note added 9/15/15 17:03
nc,,NC Progress Portal -- Note added 9/15/15 17:03
"board,nc",,nc psychology board -- Note added 9/15/15 17:03
"board,carolina,north",", North Carolina",The North Carolina Board of Physical Therapy Examiners -- Note added 9/15/15 17:04
"department,north,office,department cultural resources,carolina",", North Carolina","Historical Publications, North Carolina Office of Archives and History, Department of Cultural Resources - www.ncpublications.com -- Note added 6/6/13 18:34"
"public health,public,north,health,carolina,division public health,division",", North Carolina",North Carolina Division of Public Health -- Note added 7/26/13 15:09
"nc,public",,nc public schools -- Note added 9/15/15 17:05
"department,health,nc department,nc,department health human,services,health human services",,"Radiation Protection Section, NC Department of Health and Human Services -- Note added 1/14/14 14:18"
"site,nc",,NC Radon Awarenes Site -- Note added 9/15/15 17:05
"site,nc,services",,"We serve the NC insurance industry by providing services and programs for automobile, property and workers compensation insurance. This site contains information for these types of insurance. -- Note added 9/15/15 17:06"
"carolina,north",", North Carolina",the North Carolina Respiratory Care   -- Note added 9/15/15 17:13
"carolina,north,authority",", North Carolina",North Carolina Rural Electrification Authority -- Note added 9/15/15 17:14
"state,health,board,nc,state board",,NC State Board of Environmental Health Specialist Examiners -- Note added 11/19/13 20:40
nc,,nc report cards for schools -- Note added 9/15/15 17:16
nc,,nc science and technology -- Note added 9/15/15 17:17
nc,,NC School for the deaf -- Note added 9/15/15 17:17
"nc,state",,NC State Employees Combined Campaign -- Note added 9/15/15 17:18
"health,carolina,north",", North Carolina",North Carolina Seniors' Health Insurance Information Program (SHIIP) -- Note added 1/22/14 19:19
"department,public,north,health,nc department,nc,nc department public,carolina,public health",", North Carolina","North Carolina Sickle Cell Syndrome Program, NC Department of Public Health -- Note added 11/12/15 13:09"
"north,state,department,public,carolina department,nc,carolina,division",", North Carolina",The North Carolina State Improvement Project (NC SIP ). NC SIP is a program in the Exceptional Children Division of the North Carolina Department of Public Instruction (NC DPI). -- Note added 9/15/15 17:19
"carolina,site,north",", North Carolina","Thank you for visiting ACCESSNC, your one-stop source for North Carolina economic data and site information. -- Note added 9/15/15 17:19"
"health,carolina",,"The Carolina Star Program is designed to recognize and promote effective safety and health management systems. In Star, management, labor and OSH establish a cooperative relationship at a workplace that has implemented a strong program. -- Note added 9/15/15 17:20"
"nc,state",,NC state Fair -- Note added 9/15/15 17:20
"site,nc",,NC Stormwater and Runoff pollution site -- Note added 9/15/15 17:22
"nc,state",,NC State Univ Extension  -- Note added 9/15/15 17:22
"board,carolina,north",", North Carolina",North Carolina Social Work Certification and Licensure Board -- Note added 9/22/15 14:12
nc,,NC Symphony -- Note added 9/15/15 17:22
"department,health,nc department,nc,department health human,services,health human services",,"Tobacco Free Schools, NC Department of Health and Human Services -- Note added 2/25/14 13:20"
"carolina,office,north,state",", North Carolina",State of North Carolina Japan Office -- Note added 7/24/13 16:40
,,NC-TOPPS homepage is now http://www.ncdhhs.gov/MHDDSAS/providers/NCTOPPS/index.htm. Entry still included here for nctopps.ncdmh.net pattern for pages such as https://www.google.com/search?q=site%3Anctopps.ncdmh.net. -- Note added 7/23/14 14:41
"office,nc,state",,NC Office of State Personnel -- Note added 1/14/14 13:06
nc,,NC Transportation Museum -- Note added 9/15/15 17:25
"department,north,state,carolina department,carolina",", North Carolina",North Carolina Department of State Treasurer -- Note added 6/6/13 18:09
"board,carolina,north",", North Carolina",North Carolina Veterinary Medical Board -- Note added 9/15/15 17:30
north,", North Carolina",North Carolina's marketplace for discarded or surplus materials and products. -- Note added 9/15/15 17:31
"division,nc",,NC Division of Water Resources -- Note added 9/15/15 17:31
"carolina,division,north",", North Carolina",North Carolina Division of Water Resources -- Note added 11/12/15 12:58
"public,north,commission,department,health,department health human,services,carolina,public health,health human services",", North Carolina","North Carolina Well Contractors Certification Commission - protects the public health and safety by ensuring the integrity and competence of well contractors through examination, certification, continuing education and enforcement. The Well Contractors Certification Unit is now part of the Department of Health and Human Services. -- Note added 11/12/15 12:57"
"nc,commission",,nc wildlife resource commission  -- Note added 9/15/15 17:32
"nc,public",,"NC WiseOwl (NC Online Windows for Learning) has been providing online subscription resources for our schools since 1999.  Our mission is to ensure that all of our public and charter school students have access to a collection of online resources for use in research projects and homework assignments, without regard to the economic status of their local school system.  NC WiseOwl has three major strengths as an educational resource: -- Note added 9/15/15 17:33"
"department,north,carolina department,nc,carolina",", North Carolina",NC Zoo is an agency of the North Carolina Department of Natural and Cultural Resources -- Note added 11/12/15 12:48
north,", North Dakota",North Dakota League of Cities -- Note added 7/22/14 6:08
department,", Nevada",Nevada Department of Wildlife -- Note added 1/27/14 20:15
department,", Nevada",Nevada Department of Wildlife (NDOW) Licensing -- Note added 10/21/13 11:53
north,", North Dakota",North Dakota Recorders Information Network -- Note added 7/21/14 6:33
"travel tourism,travel tourism site,north,travel,tourism,tourism site,site",", North Dakota",Travel and Tourism Site for North Dakota -- Note added 6/6/13 19:42
board,", Nebraska",Nebraska Ethanol Board -- Note added 12/6/13 19:53
,", Nebraska",Nebraska AgRelations Council -- Note added 12/6/13 19:45
,", Nebraska",Nebraska Association of Transportation Providers -- Note added 12/6/13 20:02
state,", Nebraska","Nebraska Arts Council. The Council is funded by the State of Nebraska, the National Endowment for the Arts, and the Nebraska Cultural Endowment. -- Note added 12/6/13 19:38"
board,", Nebraska",Nebraska Corn Board -- Note added 12/6/13 19:41
commission,", Nebraska",Nebraska Dry Bean Commission -- Note added 12/6/13 19:49
state,", Nebraska",Nebraska State Historical Society -- Note added 12/9/13 18:24
"commission,state",", Nebraska",Nebraska State Racing Commission -- Note added 12/6/13 20:01
board,", Nebraska",Nebraska Wheat Board -- Note added 12/6/13 20:06
"department,economic development",", Nebraska",Nebraska Department of Economic Development -- Note added 12/6/13 19:50
lottery,", Nebraska",Nebraska Lottery -- Note added 6/12/13 14:18
department,", Nevada",Nevada Department of Transportation -- Note added 6/26/13 15:23
,", Nevada",The Nevada Judiciary -- Note added 1/24/14 13:06
"travel tourism,travel tourism site,travel,tourism,tourism site,site",", New Mexico",Travel and Tourism Site for New Mexico -- Note added 6/6/13 19:42
"department,economic development",", Pennsylvania",Pennsylvania Department of Community & Economic Development -- Note added 6/6/13 18:08
,", Nebraska",Nebraska Forest Service -- Note added 12/6/13 19:55
,,NH Historical Society -- Note added 9/2/15 19:01
,,NH Municipal Association -- Note added 9/2/15 19:02
"lottery,commission",", New Hampshire",New Hampshire Lottery Commission -- Note added 6/12/13 14:19
state,,NH State Parks -- Note added 9/2/15 19:03
"economic development authority,economic development,authority",", New Jersey",New Jersey Economic Development Authority -- Note added 9/16/15 15:52
"division,department",,"Division of Fish and Wildlife, NJ Department of Environmental Protection -- Note added 6/7/13 11:33"
state,", New Jersey",New Jersey State Library -- Note added 7/26/13 16:17
,", New Jersey",New Jersey Surcharge Violation System (NJSVS) -- Note added 9/16/15 15:53
department,,Department of Labor and Workforce Development   -- Note added 9/16/15 15:53
lottery,", New Mexico",New Mexico Lottery -- Note added 6/12/13 14:20
"health,public health,public",", New Mexico",New Mexico Environmental Public Health Tracking -- Note added 10/24/14 12:11
,", New Mexico","Special Supplemental Nutrition Program for New Mexico Women, Infants & Children -- Note added 1/10/14 19:17"
"public health,public,health,nc,services,division public health,division,health human services",,"Nutrition Services Branch, Women's and Children's Health, NC Division of Public Health, NCDepartment of Health and Human Services  -- Note added 3/20/14 16:33"
"department,state,health,department health human,services,division,health human services",", Nevada","Aging and Disability Services Division, Department of Health and Human Services, State of Nevada -- Note added 6/17/13 15:40"
"york state,state",", New York",New York State Conference of Mayors and Municipal Officials (NYCOM) -- Note added 7/2/15 10:49
,", New York",New York Historical Society Museum and Library -- Note added 7/2/15 10:50
"york state,state",", New York",New York State Council on the Arts -- Note added 7/2/15 10:51
"state agencies,york state,state",", New York",New York State eGovernment listing of state agencies -- Note added 9/25/13 15:35
"york state,state",", New York",New York State Fair -- Note added 6/12/13 18:48
"york state,state",", New York",New York State Homes and Community Renewal -- Note added 9/9/15 13:48
"york state,state",", New York",New York State Local Government IT Directors Association (NYSLGITDA) -- Note added 7/2/15 10:59
"york state,state",", New York",New York State Police Recruitment Center -- Note added 1/3/14 13:14
commission,,OK Corporation Commission -- Note added 8/28/15 18:20
office,", Hawaii","Office of Hawaiian Affairs - 'Under the direction of nine trustees elected statewide, OHA has functioned operationally as both a government agency with a strong degree of autonomy, and as a trust.' -- Note added 6/12/13 13:27"
,", Ohio",Ohio Bureau of Workers' Compensation -- Note added 3/26/14 18:21
,", Ohio",Ohio Humanities Council -- Note added 3/26/14 18:28
lottery,", Ohio",Ohio Lottery -- Note added 6/12/13 14:22
,", Ohio",Ohio Recorders' Association -- Note added 3/26/14 18:36
,", Oregon",Oregon Historical Society -- Note added 6/20/14 7:38
,,OK career tech website -- Note added 8/28/15 18:21
services,,OK dept of human services -- Note added 8/28/15 18:21
department,", Oklahoma","OKLibShare, Oklahoma Department of Libraries -- Note added 8/27/15 16:00"
commission,,OK LP Gas commission -- Note added 8/28/15 18:22
state,", Virginia",State of Virginia Olmstead Initiative -- Note added 8/27/15 14:13
,", Ohio",Ohio Municipal League -- Note added 3/26/14 18:40
"office,division,north",", North Carolina","Office of Land and Water Stewardship, a non-regulatory division within North Carolina's DENR that provides information and assistance to support effective conservation and resilient communities.  -- Note added 11/12/15 12:36"
commission,", Oregon",Oregon Arts Commission -- Note added 6/20/14 7:34
office,", Oregon",Oregon Governor's Office of Film and Television -- Note added 3/20/14 16:53
lottery,", Oregon",Oregon Lottery -- Note added 6/12/13 14:22
state,", Oregon",Oregon State Fair -- Note added 6/20/14 7:22
,", Oklahoma","The Oklahoma Resources Integration General Information Network System (Origins) is an online database which contains economic, social, and demographic data intended for use by community leaders, educators, businesses, government agencies, and decision makers. -- Note added 8/28/15 18:22"
"office,state",", Kansas",Office of the State Bank Commissioner of Kansas -- Note added 7/10/14 6:29
state,,OK State Court System -- Note added 8/28/15 18:23
"office,state",", Maryland",Office of the Maryland State Prosecutor -- Note added 5/27/14 3:40
"carolina,division,north",", North Carolina",North Carolina Division of Environmental Assistance and Customer Service   -- Note added 9/15/15 17:43
,", Pennsylvania",Commonwealth of Pennsylvania's media hub -- Note added 6/6/13 18:08
,", Pennsylvania",Unified Judicial System of Pennsylvania -- Note added 1/10/14 15:20
authority,,PA eHealth Partnership Authority -- Note added 6/7/13 11:53
,", Pennsylvania",Pennsylvania FirstNet. See also http://www.ntia.doc.gov/sligp/pennsylvania.  -- Note added 9/24/14 16:11
,", Palau",Republic of Palau National Government -- Note added 6/7/13 18:27
,", Palau",Palau Judiciary Branch -- Note added 5/27/14 15:03
"office,public,state",", Georgia",Georgia State Defense Force public affairs office. Website mirrored on gasdf.com. Referenced on https://ga.ng.mil/Leadership/Georgia-State-Defense-Force/.
,", South Dakota",South Dakota Parks & Wildlife Foundation -- Note added 7/17/14 5:50
state,,PA State System of Higher Education -- Note added 6/7/13 11:53
authority,,PA Patient Safety Authority -- Note added 6/7/13 11:53
commission,", Pennsylvania",Pennsylvania Turnpike Commission -- Note added 10/1/14 18:05
health,,PA Health Care Cost Containment Council -- Note added 6/7/13 11:53
,,PA Higher Education Assistance Agency -- Note added 6/7/13 11:53
authority,,PA Higher Educational Facilities Authority -- Note added 6/7/13 11:53
,,PA Housing Finance Agency -- Note added 6/7/13 11:53
state,", Mississippi","Pat Harrison Waterway District (PHWD), a Mississippi State Agency that provides camping, cabins and recreational facilities in Mississippi -- Note added 1/13/14 20:28"
"carolina,authority",", South Carolina",South Carolina Ports Authority -- Note added 6/6/13 18:08
,", Virginia",The Port of Virginia -- Note added 7/14/14 17:09
"commission,state",", Washington",Washington State Potato Commission -- Note added 11/17/14 7:11
"office,state,commission",", Alabama","Alabama Historical Commission, State of Alabama Historic Preservation Office -- Note added 7/15/13 18:19"
"department,north,carolina department,department cultural resources,carolina",", North Carolina","Queen Anne's Revenge, a project of the http://www.qaronline.org/ North Carolina Department of Cultural Resources to educate the next generation on colonial life -- Note added 11/20/13 17:34"
state,", Maryland","Uninsured Employers' Fund, State of Maryland -- Note added 11/20/13 17:37"
state,,OK State AG Econ at OSU -- Note added 8/28/15 18:25
"public,department,nc department,nc,nc department public",,"Ready NC, NC Department of Public Safety -- Note added 1/14/14 14:35"
,", Pennsylvania","Ready PA, Pennsylvania Emergency Management Agency -- Note added 4/16/14 15:38"
commission,", Washington",Washington Red Raspberry Commission -- Note added 11/17/14 7:07
"board,state board,state",,The State Board of Refrigeration Examiners -- Note added 9/15/15 17:47
"division,department,department education",", Florida",Division of Vocational Rehabilitation - Florida Department of Education -- Note added 7/1/15 18:43
,", Rhode Island",Rhode Island Clean Water Finance Agency -- Note added 1/27/14 19:35
,", Rhode Island",Rhode Island Emissions and Safety Testing -- Note added 1/7/14 18:45
lottery,", Rhode Island",Rhode Island Lottery -- Note added 6/7/13 18:46
"public,commission",", Rhode Island",Rhode Island Public Utilities Commission -- Note added 1/29/14 15:24
authority,", Rhode Island",Rhode Island Turnpike and Bridge Authority -- Note added 1/27/14 15:54
office,", Marshall Islands","Office of the President, Republic of the Marshall Islands -- Note added 6/12/13 13:31"
state,", Montana","SafeMT, a resource of the Montana State Fund for safety in Montana's workplaces. -- Note added 11/18/13 16:35"
"site,nc",,NC Safe Haven Law - Abandoned Infant Protection Law Site -- Note added 9/15/15 17:54
health,", Virginia","The website of the Virginia Center on Aging (VCoA), a statewide agency created by the Virginia General Assembly and housed at Virginia Commonwealth University in the School of Allied Health Professions. VCoA works to protect and improve the quality of life of older Virginians, so that they might remain interdependent and contributing members to life in Virginia. -- Note added 6/27/14 14:23"
"carolina,public,authority",", South Carolina","Santee Cooper, also known officially from the 1930s as the South Carolina Public Service Authority, is South Carolina's state-owned electric and water utility that came into being during the New Deal. -- Note added 8/25/14 16:04"
"office,state",", New Mexico",New Mexico Office of the State Auditor -- Note added 7/16/14 5:38
nc,,Save Water NC -- Note added 11/12/15 12:34
"board,state board,state",", Florida","Florida State Board of Administration, created by the Florida Constitution and is governed by a three-member Board of Trustees (Trustees), comprised of the Governor as Chair, the Chief Financial Officer and the Attorney General. -- Note added 8/25/14 16:59"
"board,state board,state",", Washington",Washington State Board for Community and Technical Colleges -- Note added 4/8/14 18:22
"authority,state",,"State College Borough Water Authority, PA -- Note added 10/1/14 20:16"
,,SC dept of commerce -- Note added 8/28/15 15:19
,,SC judicial courts -- Note added 8/28/15 15:19
,,SC DMV -- Note added 8/28/15 15:20
"carolina,lottery",", South Carolina",South Carolina Education Lottery -- Note added 6/12/13 14:24
"carolina,division",", South Carolina",South Carolina Emergency Management Division -- Note added 8/28/15 15:20
,,SC early childhood education program -- Note added 8/28/15 15:20
,,SC Gov Mansion  -- Note added 8/28/15 15:23
,,SC govoners school for science and math -- Note added 8/28/15 15:23
national guard,,SC National Guard -- Note added 8/28/15 15:24
"public,state",", Virginia","The State Council of Higher Education for Virginia (SCHEV) makes higher education public policy recommendations to the Governor and General Assembly in such areas as capital and operating budget planning, enrollment projections, institutional technology needs, and student financial aid. -- Note added 6/27/14 14:25"
"department,public,north,carolina department,carolina",", North Carolina","School Planning Section, North Carolina Department of Public Instruction -- Note added 8/25/14 15:01"
carolina,", South Carolina",South Carolina Independent Living Council (SCILC) -- Note added 9/22/15 15:16
carolina,", South Carolina",South Carolina Independent Living Council (SCILC) -- Note added 9/22/15 15:17
carolina,", South Carolina","The South Carolina EPSCoR/IDeA Program, CCCR COBRE, and the USC School of Medicine Instrumentation Resource Facility -- Note added 8/28/15 15:28"
,,SC malpractice patient compensation fund -- Note added 8/28/15 15:27
carolina,", South Carolina",South Carolina School for the Deaf and Blind -- Note added 8/25/14 15:03
carolina,", South Carolina",South Carolina Statewide Independent Living Council (SILC) -- Note added 9/22/15 15:19
state,,SC sec of state -- Note added 8/28/15 15:29
"carolina department,carolina,department",", South Carolina",South Carolina Department of Revenue -- Note added 8/25/14 15:04
"carolina,commission",", South Carolina",South Carolina Higher EducationTuition Grants Commission -- Note added 8/28/15 15:30
state,,SC State Election Committee -- Note added 8/28/15 15:30
,,SC Vocab Rehab -- Note added 8/28/15 15:31
department,", South Dakota",South Dakota Department of Transportation -- Note added 7/17/14 5:53
authority,", South Dakota",South Dakota Housing Development Authority -- Note added 7/17/14 5:54
"carolina,north,state",,STATE EMPLOYEES ASSOCIATION OF NORTH CAROLINA -- Note added 9/15/15 17:56
,", Michigan","Seeking Michigan, the online platform for the http://michigan.gov/mhc Michigan Historical Center. It includes http://www.michigan.gov/archivesofmi Archives of Michigan research guides and indexes, a blog, and educator resources&ndash;all from the Michigan Historical Center and Archives of Michigan staff. -- Note added 7/9/14 12:06"
,", Minnesota",Minnesota Senate -- Note added 11/9/15 20:36
"division,department",", Arizona","Authorized Service Website for the Arizona Department of Transportation, Motor Vehicle Division -- Note added 1/10/14 19:17"
"authority,state",", Mississippi",Mississippi State Port Authority -- Note added 7/25/14 20:50
"health,carolina,north,state",", North Carolina",North Carolina State Health Plan for Teachers and State Employees -- Note added 7/25/14 15:10
,,SLED (Statewide Library Electronic Doorway) -- Note added 6/6/13 18:08
